{
  "type": [
    "MerkleProof2017",
    "Extension"
  ],
  "merkleRoot": "68f3ede17fdb67ffd4a5164b5687a71f9fbb68da803b803935720f2aa38f7728",
  "targetHash": "c9ead76a54426b4ce4899bb921e48f5b55ea7592e5cee4460c86ebf4698ac3a6",
  "proof": [
    {
      "right": "7fef060cb17614fdfddd8c558e102fbb96433f5281e96c80f805459773e51163"
    }
  ],
  "anchors": [
    {
      "sourceId": "8623beadbc7877a9e20fb7f83eda6c1a1fc350171f0714ff6c6c4054018eb54d",
      "type": "BTCOpReturn"
    }
  ]
}